[
{"id":"grain","name":"Grain","classes":["primary"],"introduced":1700},{"id":"livestock","name":"Livestock","classes":["primary"],"introduced":1700},{"id":"timber","name":"Timber","classes":["primary"],"introduced":1700},{"id":"fish","name":"Fish","classes":["primary"],"introduced":1700},{"id":"coal","name":"Coal","classes":["primary"],"introduced":1700},{"id":"iron_ore","name":"Iron Ore","classes":["primary"],"introduced":1700},{"id":"stone","name":"Stone","classes":["primary"],"introduced":1700},{"id":"clay","name":"Clay","classes":["primary"],"introduced":1700},{"id":"oil","name":"Oil","classes":["primary"],"introduced":1850},{"id":"gas","name":"Natural Gas","classes":["primary"],"introduced":1900},{"id":"copper_ore","name":"Copper Ore","classes":["primary"],"introduced":1850},{"id":"sand","name":"Sand","classes":["primary"],"introduced":1700},{"id":"bauxite","name":"Bauxite","classes":["primary"],"introduced":1886},{"id":"titanium_ore","name":"Titanium Ore","classes":["primary"],"introduced":1940},{"id":"gold_ore","name":"Gold Ore","classes":["primary"],"introduced":1700},{"id":"silver_ore","name":"Silver Ore","classes":["primary"],"introduced":1700},{"id":"rare_earth_ore","name":"Rare Earth Ore","classes":["primary"],"introduced":1960},{"id":"coke","name":"Coke","classes":["material"],"introduced":1750},{"id":"steel","name":"Steel","classes":["material","product"],"introduced":1750},{"id":"copper","name":"Copper","classes":["material","product"],"introduced":1850},{"id":"glass","name":"Glass","classes":["material","product"],"introduced":1800},{"id":"ceramics","name":"Ceramics","classes":["material","product"],"introduced":1700},{"id":"aluminum","name":"Aluminum","classes":["material","product"],"introduced":1886},{"id":"titanium","name":"Titanium","classes":["material","product"],"introduced":1940},{"id":"gold","name":"Gold","classes":["material","product","financial"],"introduced":1700},{"id":"silver","name":"Silver","classes":["material","product","financial"],"introduced":1700},{"id":"rare_earth_materials","name":"Rare Earth Materials","classes":["material","product","financial"],"introduced":1960},{"id":"cement","name":"Cement","classes":["material","product"],"introduced":1800},{"id":"food","name":"Food","classes":["product"],"introduced":1700},{"id":"lumber","name":"Lumber","classes":["product"],"introduced":1700},{"id":"petroleum_products","name":"Petroleum Products","classes":["product"],"introduced":1850},{"id":"machinery","name":"Machinery","classes":["product"],"introduced":1800},{"id":"chemicals","name":"Chemicals","classes":["product","operational_supply"],"introduced":1850},{"id":"manufactured_goods","name":"Manufactured Goods","classes":["product"],"introduced":1850},{"id":"electronics","name":"Electronics","classes":["product"],"introduced":1950},{"id":"advanced_goods","name":"Advanced Goods","classes":["product"],"introduced":2000},{"id":"tools_hardware","name":"Tools & Hardware","classes":["operational_supply"],"introduced":1700},{"id":"industrial_equipment","name":"Industrial Equipment","classes":["operational_supply"],"introduced":1850},{"id":"construction_materials","name":"Construction Materials","classes":["operational_supply"],"introduced":1700},{"id":"agricultural_supplies","name":"Agricultural Supplies","classes":["operational_supply"],"introduced":1700},{"id":"technology_systems","name":"Technology Systems","classes":["operational_supply"],"introduced":1980},{"id":"fuel","name":"Fuel","classes":["operational_supply"],"introduced":1850},{"id":"passengers","name":"Passengers","classes":["human_flow"],"introduced":1700},{"id":"personnel","name":"Personnel","classes":["human_flow"],"introduced":1700},{"id":"mail","name":"Mail","classes":["human_flow"],"introduced":1700}
]
